{
  "id": "urn:uuid:test-plan-001",
  "plan_id": "PLAN-TEST-001",
  "objective": "Verify Disk Space for ODA Operations",
  "jobs": [
    {
      "id": "job-test-01",
      "action_name": "run_command",
      "action_args": {"command": "df -h"},
      "description": "Check available space on /home/palantir. Ensure we have >10GB for testing.",
      "role": "Mechanic",
      "input_context": ["/home/palantir/AGENTS.md"]
    }
  ]
}
